{
  "schema_version": "2.1",
  "packet_id": "chatgpt-complexity-gap-ensemble-intake-20260811T093502Z",
  "packet_nonce": "54e4bb8b-fc38-4254-bc09-bf1c86aab544",
  "created_at": "2026-08-11T09:35:02.3522848Z",
  "freshness": {
    "source_observed_at": "2026-08-11T09:35:02.3522848Z",
    "source_revision": "chat-visible-final-response:package-sha256:ccdc1d7afe395018223ecffb540918663e72d529d9bba40cc5677b75c4884666",
    "max_age_seconds": 604800,
    "supersedes_packet_id": null
  },
  "source_project_id": "g-p-6a74ab83668081919f5cbd0dfe80eb09",
  "source_conversation_id": "6a7992db-96b8-83ec-aab0-6a7447b97da1",
  "source_chat_title": "Perfume Project Planning",
  "target_conversation_id": "6a77b1b5-fabc-83ec-896b-9b7c5c5a2ebf",
  "objective": "Admit the newly completed Complexity Gap Detection Ensemble v1 attachment bytes to append-only quarantine and route them to the existing Plan perfume-chem integration owner without installation or authority promotion.",
  "summary": "The authenticated ChatGPT response exposed a new 58,306-byte ZIP and 131-byte checksum sidecar. Both were downloaded through visible controls, copied byte-for-byte into incoming_review, and hash-verified. The ZIP has 39 unique safe entries, clean CRC, 37 of 37 internal declared hashes matching, and native archive status CLEAR_FOR_RECEIPT_REVIEW with promotion_allowed=false. Its design is relevant to the Plan integration but remains an advisory implementation asset: it proposes typed read-only complexity-gap schemas and detectors while the current exact-project P2.2 decision found no new schema or migration proven. No package file was installed or extracted into canonical paths.",
  "decisions": [
    {
      "decision": "Stage exact original ZIP and sidecar bytes only.",
      "reason": "Original attachment recovery is separate from code admission, schema admission, migration approval, scientific acceptance, and release."
    },
    {
      "decision": "Route the package to the existing Plan integration owner for field-level reuse analysis.",
      "reason": "The package sits above existing reconstruction, complexity, floral, interaction, lattice, admission, and evidence-spine modules and therefore overlaps the Plan owner's exact field/dependency mapping."
    },
    {
      "decision": "Do not adopt the package's proposed schemas or ordered implementation plan yet.",
      "reason": "The current P2.2 exact-project decision reports substantial native reuse, no new schema or migration proven, and migration head 0016. The package was built without the exact synchronized broader corpus or live repository installation."
    }
  ],
  "claims": [
    {
      "claim": "The exact Complexity Gap Detection Ensemble v1 ZIP bytes are now available in Perfume-Chem quarantine.",
      "evidence": "58,306 bytes; SHA-256 ccdc1d7afe395018223ecffb540918663e72d529d9bba40cc5677b75c4884666"
    },
    {
      "claim": "The separate sidecar declares the same package SHA-256 and matches the downloaded ZIP.",
      "evidence": "Sidecar 131 bytes; SHA-256 5bd88d50130d03ae1a95b7982d4647b24554cf0feed1e08a48aaa730fb4adf66"
    },
    {
      "claim": "The package is structurally clear for receipt review but not promoted.",
      "evidence": "39/39 unique safe ZIP paths; CRC clean; 37/37 internal hashes match; archive graph CLEAR_FOR_RECEIPT_REVIEW; all_nodes_terminal=true; promotion_allowed=false"
    },
    {
      "claim": "The package explicitly withholds physical and hedonic claims.",
      "evidence": "MANIFEST.json claims_withheld includes beauty, liking, similarity, stability, safety, measured headspace, strict empirical OAV, skin performance, and release."
    },
    {
      "claim": "The package's first live-repository action is read-only discovery, not patching.",
      "evidence": "docs/10_CODEX_EXECUTION_PACKET.md requires branch/HEAD, working-tree, module-interface, evidence-spine, and test discovery before any patch."
    }
  ],
  "active_artifacts": [
    {
      "path": "incoming_review/chatgpt/20260811T093412Z-planning-6a7992db-185c6611/capture_manifest.json",
      "role": "browser capture provenance and validation manifest"
    },
    {
      "path": "incoming_review/chatgpt/20260811T093412Z-planning-6a7992db-185c6611/Perfume_Chem_Complexity_Gap_Detection_Ensemble_2026-08-11_v1.zip",
      "role": "untrusted original package bytes"
    },
    {
      "path": "incoming_review/chatgpt/20260811T093412Z-planning-6a7992db-185c6611/Perfume_Chem_Complexity_Gap_Detection_Ensemble_2026-08-11_v1.zip.sha256",
      "role": "untrusted original checksum sidecar bytes"
    }
  ],
  "constraints": [
    "No package installation, canonical extraction, schema admission, database migration, code mutation, formula mutation, inventory mutation, or release action was performed.",
    "The package's source-declared VALIDATED_IMPLEMENTATION_ASSET state is not Codex acceptance or exact-project compatibility proof.",
    "Its 18-profile portfolio scan is corpus-bounded and cannot establish universal perfume white space or target gaps.",
    "The package's BRIDGE_BLOCKED wording is preserved as a source claim and does not override newer local bridge-intake evidence or the still-separate remote-canary gate.",
    "No physical result, liking, similarity, stability, safety, measured headspace, strict OAV, skin performance, commercial equivalence, or release result is claimed.",
    "ACCORD-INTEL Chat 2 / DARK MATERIALS remains separate; this package is routed to Plan integration only."
  ],
  "unresolved_questions": [
    "Which proposed ArchitectureProfile, DetectorFinding, ComplexityGapReport, and detector fields are exact aliases of P2.2 native fields, and which are genuinely absent?",
    "Can the package's 15-detector registry be represented as policy/dependency configuration without a new persisted schema or migration?",
    "Do package fixtures replay against the synchronized CrossBrand, Kenny-original, and accepted empirical corpora without inventing target or sensory authority?",
    "Does the package introduce duplicate logic already covered by Meaningful Complexity, Floral Coverage, Interaction Atlas, Six-Pilot, M0-M11, and the evidence spine?"
  ],
  "next_actions": [
    {
      "action": "Plan owner performs exact field-level diff against the sealed P2.2 catalog, policy/dependency registry, and field matrix before any implementation decision.",
      "authority": "Plan perfume-chem integration owner"
    },
    {
      "action": "If native reuse is sufficient, map detectors to existing fields and keep migration head 0016; otherwise require a new explicit schema-necessity proof.",
      "authority": "Sol/Codex architecture review"
    },
    {
      "action": "Keep the package in incoming_review quarantine until dependency, fixture, source-receipt, and rollback checks pass.",
      "authority": "Sol/Codex quarantine review"
    }
  ],
  "conflicts": [
    {
      "scope": "Schema and migration necessity",
      "state": "HOLD_PLAN_DIFF_REQUIRED",
      "detail": "The package proposes adding typed schemas and a complexity_gap subsystem. The current exact-project P2.2 decision found substantial native reuse, no new schema or migration proven, no parallel store, and migration head 0016."
    },
    {
      "scope": "Repository and bridge state",
      "state": "SOURCE_WORDING_STALE_OR_SCOPE_DIFFERENT",
      "detail": "The package says NOT PERFORMED / BRIDGE_BLOCKED. Exact bytes have now been recovered locally through authenticated browser controls and admitted to append-only quarantine, but no remote connector canary or canonical installation is inferred."
    },
    {
      "scope": "Portfolio scan coverage",
      "state": "CORPUS_BOUNDED",
      "detail": "The supplied scan covers 18 Six-Pilot branches and 15 axes; the source chat itself says the exact broader CrossBrand and Kenny-original workbooks were not mounted. Findings remain portfolio white-space hypotheses, not target gaps."
    }
  ],
  "source_refs": [
    {
      "kind": "chatgpt_conversation",
      "id": "6a7992db-96b8-83ec-aab0-6a7447b97da1",
      "uri": "chatgpt-conversation://6a7992db-96b8-83ec-aab0-6a7447b97da1",
      "title": "Perfume Project Planning"
    },
    {
      "kind": "codex_task",
      "id": "019feb17-3324-7623-9eac-3b7e817acd4c",
      "uri": "codex://threads/019feb17-3324-7623-9eac-3b7e817acd4c",
      "title": "Plan perfume-chem integration"
    },
    {
      "kind": "codex_task",
      "id": "019fe3a3-3cca-7462-b8e9-e315015e95df",
      "uri": "codex://threads/019fe3a3-3cca-7462-b8e9-e315015e95df"
    }
  ],
  "content_hashes": [
    {
      "algorithm": "sha256",
      "digest": "828d404362a5a56a8affc2b180f8767cc8843a2eba14e7511e11746f0d11267c",
      "path": "incoming_review/chatgpt/20260811T093412Z-planning-6a7992db-185c6611/capture_manifest.json"
    },
    {
      "algorithm": "sha256",
      "digest": "ccdc1d7afe395018223ecffb540918663e72d529d9bba40cc5677b75c4884666",
      "path": "incoming_review/chatgpt/20260811T093412Z-planning-6a7992db-185c6611/Perfume_Chem_Complexity_Gap_Detection_Ensemble_2026-08-11_v1.zip"
    },
    {
      "algorithm": "sha256",
      "digest": "5bd88d50130d03ae1a95b7982d4647b24554cf0feed1e08a48aaa730fb4adf66",
      "path": "incoming_review/chatgpt/20260811T093412Z-planning-6a7992db-185c6611/Perfume_Chem_Complexity_Gap_Detection_Ensemble_2026-08-11_v1.zip.sha256"
    }
  ],
  "authority": {
    "level": "SOURCE_CAPTURE",
    "accepted_by_codex": false
  },
  "acknowledgement": {
    "read_at": null,
    "accepted": false
  }
}
